{
  "$schema": "https://json-schema.org/draft/2020-12/schema",
  "$id": "smarthive/contracts/summary.schema.json",
  "title": "Summary",
  "description": "Vision summary of a 10 minute window (node to server)",
  "type": "object",
  "properties": {
    "schema": {
      "type": "string",
      "pattern": "^smarthive\\.summary/1\\.[0-9]+$"
    },
    "msg_id": {
      "type": "string",
      "pattern": "^[0-9a-f]{8}-[0-9a-f]{4}-[0-9a-f]{4}-[0-9a-f]{4}-[0-9a-f]{12}$"
    },
    "node_id": {
      "type": "string",
      "minLength": 1
    },
    "boot_id": {
      "type": "string",
      "pattern": "^[0-9a-f]{8}-[0-9a-f]{4}-[0-9a-f]{4}-[0-9a-f]{4}-[0-9a-f]{12}$"
    },
    "sent_at": {
      "type": "string",
      "pattern": "^\\d{4}-\\d{2}-\\d{2}T\\d{2}:\\d{2}:\\d{2}(\\.\\d+)?Z$"
    },
    "window": {
      "type": "object",
      "required": [
        "start",
        "end",
        "clock_synced"
      ],
      "properties": {
        "start": {
          "type": "string",
          "pattern": "^\\d{4}-\\d{2}-\\d{2}T\\d{2}:\\d{2}:\\d{2}(\\.\\d+)?Z$"
        },
        "end": {
          "type": "string",
          "pattern": "^\\d{4}-\\d{2}-\\d{2}T\\d{2}:\\d{2}:\\d{2}(\\.\\d+)?Z$"
        },
        "clock_synced": {
          "type": "boolean"
        }
      }
    },
    "frames_analyzed": {
      "type": "integer",
      "minimum": 0
    },
    "counts": {
      "type": "object",
      "additionalProperties": {
        "type": "integer",
        "minimum": 0
      }
    },
    "varroa": {
      "type": "object",
      "required": [
        "bees_classified",
        "positive"
      ],
      "properties": {
        "bees_classified": {
          "type": "integer",
          "minimum": 0
        },
        "positive": {
          "type": "integer",
          "minimum": 0
        }
      }
    },
    "latency_ms_p95": {
      "type": "object",
      "additionalProperties": {
        "type": "number"
      }
    }
  },
  "required": [
    "schema",
    "msg_id",
    "node_id",
    "boot_id",
    "sent_at",
    "window",
    "frames_analyzed",
    "counts",
    "varroa"
  ]
}
